{
  "contract_version": 1,
  "water_review": {"path": "regions/douglas-co/water-review.json"},
  "region": {"id": "douglas-co", "name": "Douglas County, Colorado", "state": "CO", "status": "research_only"},
  "coverage": {"path": "regions/douglas-co/research.json", "pointer": "/layers/coverage/features/0", "kind": "clipping_boundary", "source_id": "census_county", "statement": "County boundary used to clip sources. Water features are kept to about 500 m beyond it so that rivers on the county line are not cut into pieces. It is not a land-ownership or access boundary. Nothing else is known outside it.", "display": {"path": "regions/douglas-co/display/coverage.geojson"}},
  "sources": {
    "census_county": {"type": "agency", "agency": "US Census Bureau", "source_urls": ["https://tigerweb.geo.census.gov/arcgis/rest/services/TIGERweb/State_County/MapServer/1"], "scope": "County boundary used for clipping. Not a land-ownership polygon."},
    "usfs_trails": {"type": "agency", "agency": "USDA Forest Service", "source_urls": ["https://apps.fs.usda.gov/arcx/rest/services/EDW/EDW_TrailNFSPublishWithDataStatus_01/MapServer/0"], "scope": "Published trail geometry and use strings. Not current access or closures."},
    "usfs_mvum": {"type": "agency", "agency": "USFS", "source_urls": ["https://apps.fs.usda.gov/arcx/rest/services/EDW/EDW_MVUM_02/MapServer/1"], "scope": "Road geometry only. Vehicle and season designations are not evaluated."},
    "usfs_wilderness": {"type": "agency", "agency": "USFS", "source_urls": ["https://apps.fs.usda.gov/arcx/rest/services/EDW/EDW_Wilderness_01/MapServer/0"], "scope": "Designated wilderness boundaries. Not a statement of current rules or access."},
    "blm_sma": {"type": "agency", "agency": "BLM multi-agency Surface Management Agency", "source_urls": ["https://gis.blm.gov/arcgis/rest/services/lands/BLM_Natl_SMA_LimitedScale/MapServer/1"], "scope": "Limited-scale ownership context; not a parcel survey or camping authorization."},
    "usfs_rec_sites": {"type": "agency", "agency": "USFS", "source_urls": ["https://apps.fs.usda.gov/arcx/rest/services/EDW/EDW_RecInfraRecreationSites_02/MapServer/0"], "scope": "Recreation-site inventory. Season and operational attributes can be historical; no live open status."},
    "usgs_nhd": {"type": "agency", "agency": "USGS", "source_urls": ["https://hydro.nationalmap.gov/arcgis/rest/services/nhd/MapServer/12", "https://hydro.nationalmap.gov/arcgis/rest/services/nhd/MapServer/6"], "scope": "USGS National Hydrography Dataset, retired by USGS in 2023 and no longer maintained. Named flowlines and all waterbodies with the source's type and hydrographic category, kept to about 500 m beyond the county line; not complete hydrology. The source does not establish recreation, access or permission, or present-day flow."}
  },
  "layers": [
    {"id": "trails", "kind": "trails", "format": "feature_collection", "path": "regions/douglas-co/research.json", "pointer": "/layers/trails", "source_ids": ["usfs_trails"], "status_ref": null, "max_age_hours": 168, "geometry_types": ["LineString", "MultiLineString"], "allow_null_geometry": false, "must_be_empty": false, "extent_padding_deg": 0, "spatial_precision": "source_published", "fields": {"source": ["trail_number", "surface", "attribute_subset", "allowed_terra_use", "activities"], "derived": []}, "limitations": "Published trail geometry and use strings. Not current access or closures.", "display": {"path": "regions/douglas-co/display/trails.geojson"}},
    {"id": "roads", "kind": "roads", "format": "feature_collection", "path": "regions/douglas-co/research.json", "pointer": "/layers/roads", "source_ids": ["usfs_mvum"], "status_ref": null, "max_age_hours": 168, "geometry_types": ["LineString", "MultiLineString"], "allow_null_geometry": false, "must_be_empty": false, "extent_padding_deg": 0, "spatial_precision": "source_published", "fields": {"source": ["source_route_id"], "derived": []}, "limitations": "Road geometry only. Vehicle and season designations are not evaluated.", "display": {"path": "regions/douglas-co/display/roads.geojson"}},
    {"id": "recreation", "kind": "recreation_sites", "format": "feature_collection", "path": "regions/douglas-co/research.json", "pointer": "/layers/recreation", "source_ids": ["usfs_rec_sites"], "status_ref": {"path": "regions/douglas-co/research.json", "pointer": "/source_status/recreation"}, "max_age_hours": 168, "geometry_types": ["Point"], "allow_null_geometry": false, "must_be_empty": false, "extent_padding_deg": 0, "spatial_precision": "source_published", "fields": {"source": ["site_name", "site_type", "activity_type_list", "seasonal_operational_status", "op_status_reason", "fee_description", "open_season", "usda_portal_url", "rec1stop_url", "important_info", "restrictions", "water_availability", "restroom_availability", "directions"], "derived": []}, "limitations": "Recreation-site inventory. Season and operational attributes can be historical; no live open status.", "display": {"path": "regions/douglas-co/display/recreation.geojson"}},
    {"id": "land", "kind": "land_management", "format": "feature_collection", "path": "regions/douglas-co/research.json", "pointer": "/layers/land", "source_ids": ["blm_sma"], "status_ref": {"path": "regions/douglas-co/research.json", "pointer": "/source_status/land"}, "max_age_hours": 168, "geometry_types": ["Polygon", "MultiPolygon"], "allow_null_geometry": false, "must_be_empty": false, "extent_padding_deg": 0, "spatial_precision": "generalized", "classification_source_field": "manager", "fields": {"source": ["manager"], "derived": []}, "limitations": "Limited-scale management context. `manager` is the source agency code, verbatim.", "display": {"path": "regions/douglas-co/display/land.geojson"}},
    {"id": "wilderness", "kind": "wilderness", "format": "feature_collection", "path": "regions/douglas-co/research.json", "pointer": "/layers/wilderness", "source_ids": ["usfs_wilderness"], "status_ref": {"path": "regions/douglas-co/research.json", "pointer": "/source_status/wilderness"}, "max_age_hours": 168, "geometry_types": ["Polygon", "MultiPolygon"], "allow_null_geometry": false, "must_be_empty": false, "extent_padding_deg": 0, "spatial_precision": "source_published", "fields": {"source": ["manager"], "derived": []}, "limitations": "Designated wilderness boundaries. Not a statement of current rules or access.", "display": {"path": "regions/douglas-co/display/wilderness.geojson"}},
    {"id": "waterbodies", "kind": "water", "format": "feature_collection", "path": "regions/douglas-co/research.json", "pointer": "/layers/waterbodies", "source_ids": ["usgs_nhd"], "status_ref": {"path": "regions/douglas-co/research.json", "pointer": "/source_status/waterbodies"}, "max_age_hours": 168, "geometry_types": ["Polygon", "MultiPolygon"], "allow_null_geometry": false, "must_be_empty": false, "extent_padding_deg": 0.005, "spatial_precision": "source_published", "fields": {"source": ["gnis_id", "source_id", "ftype", "fcode", "reach_code", "area_sqkm", "elevation_m", "visibility_filter", "source_date"], "derived": ["source_namespace", "source_layer", "water_class", "hydro_category", "legacy_ids"]}, "limitations": "Rivers, streams, lakes and reservoirs selected from source type codes. Displayed streams and lakes are coded perennial; some reservoirs have no hydrographic category stated by the source. Unnamed streams and intermittent water are not shown. A mapped water feature is not evidence of access or of any allowed activity.", "display": {"path": "regions/douglas-co/display/waterbodies.geojson", "select": "bodies"}},
    {"id": "waterways", "kind": "water", "format": "feature_collection", "path": "regions/douglas-co/research.json", "pointer": "/layers/waterways", "source_ids": ["usgs_nhd"], "status_ref": {"path": "regions/douglas-co/research.json", "pointer": "/source_status/waterways"}, "max_age_hours": 168, "geometry_types": ["LineString", "MultiLineString"], "allow_null_geometry": false, "must_be_empty": false, "extent_padding_deg": 0.005, "spatial_precision": "source_published", "fields": {"source": ["gnis_id", "source_id", "ftype", "fcode", "reach_code", "length_km", "visibility_filter", "waterbody_source_id", "source_date"], "derived": ["source_namespace", "source_layer", "water_class", "hydro_category", "legacy_ids", "support_for", "support_reason", "group_id"]}, "limitations": "Rivers, streams, lakes and reservoirs selected from source type codes. Displayed streams and lakes are coded perennial; some reservoirs have no hydrographic category stated by the source. Unnamed streams and intermittent water are not shown. A mapped water feature is not evidence of access or of any allowed activity.", "display": {"path": "regions/douglas-co/display/waterways.geojson", "select": "streams"}}
  ],
  "rules": null,
  "fact_coverage": {
    "ownership": {"state": "context", "layer_ids": ["land"], "official_urls": [], "statement": "Five limited-scale management polygons only. They are not parcels or surveyed boundaries. The PVT code repeats the source's generalized classification and is not a parcel-level finding. Land outside a federal polygon is not thereby private, and unshaded land is unknown."},
    "public_access": {"state": "none", "layer_ids": [], "official_urls": [], "statement": "No public-access evidence is loaded. Ownership and access are separate questions: managing-agency context, a mapped road or trail, or nearby public land does not establish that the public may enter or cross land."},
    "camping_permission": {"state": "none", "layer_ids": [], "official_urls": [], "statement": "No camping permission is confirmed. A recreation-site record shows that a facility is listed, not that it is open or that a given setup may stay."},